{
  "id": "example:EvidenceEnvelope:conformance",
  "type": "EvidenceEnvelope",
  "producer": "example-producer",
  "producer_version": "1.0.0",
  "protocol_version": "2.0",
  "subject": "example.com pricing page",
  "generated_at": "2026-09-08T12:00:00Z",
  "as_of": "2026-09-08T12:00:00Z",
  "sensitivity": "public",
  "dependencies": [],
  "payload": {
    "schema": "cometweb.evidence/v2",
    "research_contract": "Is the listed plan price current?",
    "mode": "STANDARD",
    "as_of": "2026-09-08T12:00:00Z",
    "material_claims": [
      {
        "claim_id": "c1",
        "text": "The Basic plan costs 10 EUR per month.",
        "epistemic_kind": "FACT",
        "status": "VERIFIED",
        "materiality": "critical"
      },
      {
        "claim_id": "c2",
        "text": "The price changed this quarter.",
        "epistemic_kind": "INFERENCE",
        "status": "SUPPORTED",
        "materiality": "supporting"
      }
    ],
    "sources": [
      {
        "source_id": "s1",
        "locator": "https://example.com/pricing"
      }
    ],
    "evidence_edges": [
      {
        "edge_id": "e1",
        "claim_id": "c1",
        "source_id": "s1",
        "direction": "SUPPORT",
        "admission": "ACCEPTED"
      },
      {
        "edge_id": "e2",
        "claim_id": "c2",
        "source_id": "s1",
        "direction": "CONTEXT",
        "admission": "CONTEXT_ONLY"
      },
      {
        "edge_id": "e3",
        "claim_id": "c1",
        "source_id": "s1",
        "direction": "CONTRADICT",
        "admission": "ACCEPTED"
      }
    ],
    "gaps": [
      {
        "gap_id": "g1",
        "blocking": false,
        "statement": "No archived copy before 2026-07."
      }
    ],
    "contradictions": [
      {
        "claim_id": "c1",
        "resolution": "RESOLVED_METHOD",
        "severity": "critical"
      }
    ],
    "readiness": "READY",
    "evidence_pack_hash": "sha256:0000000000000000000000000000000000000000000000000000000000000000",
    "handoff": {
      "recommended_next_skill": "ai-council",
      "constraints": [
        "re-verify c1 before publishing"
      ]
    }
  },
  "payload_hash": "sha256:689b0364e370cd27808d9813b9df94ecd31651835b777d576a6b125af33ffc8a"
}
