{
  "id": "example:ReleaseEnvelope:defer-with-block-gate",
  "type": "ReleaseEnvelope",
  "producer": "example-producer",
  "producer_version": "1.0.0",
  "protocol_version": "2.0",
  "subject": "example.com pricing page",
  "generated_at": "2026-09-08T12:00:00Z",
  "as_of": "2026-09-08T12:00:00Z",
  "sensitivity": "public",
  "dependencies": [],
  "payload": {
    "schema": "cometweb.release/v2",
    "release_candidate": "v1.4.0-rc.2",
    "environment": "production",
    "verdict": "DEFER",
    "gates": [
      {
        "gate_id": "qa",
        "status": "CLEAR"
      },
      {
        "gate_id": "legal",
        "status": "COUNSEL_REQUIRED"
      },
      {
        "gate_id": "security",
        "status": "BLOCK"
      }
    ],
    "blockers": [],
    "controls": [],
    "as_of": "2026-09-08T12:00:00Z",
    "manifest_hash": "sha256:3333333333333333333333333333333333333333333333333333333333333333",
    "score": 0.82
  },
  "payload_hash": "sha256:3982cbf3163e1a8e537adc31aa9c7d54a9a08fe4d488f6bfec48bad5310ccc0e"
}
