{
  "id": "example:DecisionEnvelope:council-no-go",
  "type": "DecisionEnvelope",
  "producer": "example-producer",
  "producer_version": "1.0.0",
  "protocol_version": "2.0",
  "subject": "example.com pricing page",
  "generated_at": "2026-09-08T12:00:00Z",
  "as_of": "2026-09-08T12:00:00Z",
  "sensitivity": "internal",
  "dependencies": [
    "example:EvidenceEnvelope:conformance"
  ],
  "payload": {
    "schema": "cometweb.decision/v2",
    "decision_question": "Launch the annual plan in a new market?",
    "profile": "STANDARD",
    "as_of": "2026-09-08T12:00:00Z",
    "verdict": "NO_GO",
    "option": "Do not launch until the legal gate clears",
    "gates": [
      {
        "gate_id": "legal",
        "status": "BLOCK"
      },
      {
        "gate_id": "finance",
        "status": "CLEAR"
      }
    ],
    "blockers": [
      "legal gate BLOCK: consumer-law review outstanding"
    ],
    "controls": [],
    "evidence_deps": [
      "example:EvidenceEnvelope:conformance"
    ],
    "snapshot_hash": "sha256:1111111111111111111111111111111111111111111111111111111111111111",
    "validity": "VALID",
    "human_approval": "not_required"
  },
  "payload_hash": "sha256:1f19186623f878383e98281e92763230c89503ad5c4d9b549d22ff689485b5b5"
}
